{
  "$schema": "https://json-schema.org/draft/2020-12/schema", "type": "object", "additionalProperties": false,
  "required": ["$schema","product","upstream","runtime","privacy","release"],
  "properties": {
    "$schema":{"const":"../schemas/product-manifest.schema.json"},
    "product":{"type":"object","additionalProperties":false,"required":["name","version","brandClaimsVersion"],"properties":{"name":{"const":"XQ DSH Windows Kit"},"version":{"const":"1.0.0"},"brandClaimsVersion":{"const":"1"}}},
    "upstream":{"type":"object","additionalProperties":false,"required":["packageName","version","registry","tarball","integrity","sha256","git","license"],"properties":{"packageName":{"const":"@deepseek-ai/dsh"},"version":{"const":"0.1.1-rc.2"},"registry":{"const":"https://registry.npmjs.org/"},"tarball":{"const":"https://registry.npmjs.org/@deepseek-ai/dsh/-/dsh-0.1.1-rc.2.tgz"},"integrity":{"const":"sha512-UP1UIh6q3Gme/yXRn/QL2P8IsVlv8Shpg22TRJIZPsCRWLm4CBiA1MUvXmJAfsOEETBMLAl+xWPtFw6ICsN3wg=="},"sha256":{"const":"47ec05f45ada5ab87779ae18a90456b5ebff5421dc0ff5c179677d65e1c16057"},"git":{"type":"object","additionalProperties":false,"required":["repository","tag","commit"],"properties":{"repository":{"const":"https://github.com/deepseek-ai/deepseek-harness.git"},"tag":{"const":"dsh-v0.1.1-rc.2"},"commit":{"const":"b150a551b8d465e31e418e1b2eaf5e79bbb7d28e"}}},"license":{"type":"object","additionalProperties":false,"required":["spdx","url","sha256"],"properties":{"spdx":{"const":"MIT"},"url":{"const":"https://raw.githubusercontent.com/deepseek-ai/deepseek-harness/dsh-v0.1.1-rc.2/LICENSE"},"sha256":{"const":"ebb4f09972aee8608be255debaf78451a68e95c290f55c240dec2ecfa16ea6be"}}}}},
    "runtime":{"type":"object","additionalProperties":false,"required":["operatingSystem","architecture","nodeRange","webHost","webPort","sandbox","approval"],"properties":{"operatingSystem":{"const":"Windows 11"},"architecture":{"const":"x64"},"nodeRange":{"const":">=22.19.0 <23.0.0 || >=24.0.0 <25.0.0"},"webHost":{"const":"127.0.0.1"},"webPort":{"const":3080},"sandbox":{"const":"workspace-write"},"approval":{"const":"ask"}}},
    "privacy":{"type":"object","additionalProperties":false,"required":["xqTelemetry","diagnosticsUpload","sessionUpload"],"properties":{"xqTelemetry":{"const":false},"diagnosticsUpload":{"const":false},"sessionUpload":{"const":false}}},
    "release":{"type":"object","additionalProperties":false,"required":["state","lockedAtUtc","requiredGates","approvalReference","gateEvidence"],"properties":{"state":{"enum":["draft","candidate","releasable"]},"lockedAtUtc":{"format":"date-time"},"requiredGates":{"type":"array","minItems":4,"uniqueItems":true,"items":{"enum":["upstream-lock","vm-zh","vm-en","human-review"]}},"approvalReference":{"type":["null","string"],"minLength":1},"gateEvidence":{"type":["null","object"],"additionalProperties":false,"required":["upstream-lock","vm-zh","vm-en","human-review"],"properties":{"upstream-lock":{"type":"string","minLength":1},"vm-zh":{"type":"string","minLength":1},"vm-en":{"type":"string","minLength":1},"human-review":{"type":"string","minLength":1}}}},"allOf":[{"if":{"properties":{"state":{"const":"releasable"}}},"then":{"properties":{"approvalReference":{"type":"string","minLength":1},"gateEvidence":{"type":"object","required":["upstream-lock","vm-zh","vm-en","human-review"]}},"required":["approvalReference","gateEvidence"]}}]}
  }
}
